{
  "$schema": "https://json-schema.org/draft/2020-12/schema",
  "type": "array",
  "items": {
    "type": "object",
    "required": ["id", "lo", "question", "options", "explanation"],
    "properties": {
      "id": { "type": "string" },
      "lo": { "type": "string" },
      "question": { "type": "string" },
      "explanation": { "type": "string" },
      "options": {
        "type": "array",
        "minItems": 2,
        "items": {
          "type": "object",
          "required": ["id", "label", "correct"],
          "properties": {
            "id": { "type": "string" },
            "label": { "type": "string" },
            "correct": { "type": "boolean" }
          }
        }
      }
    }
  }
}
